<?xml version="1.0" encoding="UTF-8"?>
<routes xmlns='http://xml.gda.itesm.mx/schemas/TC4003.1/mirouter/1'
        xmlns:xsi='http://www.w3.org/2001/XMLSchema-instance'
        xsi:schemaLocation='http://xml.gda.itesm.mx/schemas/TC4003.1/mirouter/1
        mirouter-xsd/mirouter-xschema.xsd'>
    <nodeName>A</nodeName>
    <nodePort>10101</nodePort>
    <route>
        <destination>B</destination>
        <nodeAddress>localhost:10102</nodeAddress>
        <cost>1</cost>
        <link>1</link>
    </route>
    <route>
        <destination>D</destination>
        <nodeAddress>localhost:10104</nodeAddress>
        <cost>1</cost>
        <link>3</link>
    </route>
</routes>
