<?xml version="1.0" encoding="UTF-8"?>
<routes xmlns='http://xml.gda.itesm.mx/schemas/TC4003.1/mirouter/1'
        xmlns:xsi='http://www.w3.org/2001/XMLSchema-instance'
        xsi:schemaLocation='http://xml.gda.itesm.mx/schemas/TC4003.1/mirouter/1
        mirouter-xsd/mirouter-xschema.xsd'>
    <nodeName>B</nodeName>
    <nodePort>10102</nodePort>
    <route>
        <destination>A</destination>
        <cost>1</cost>
        <link>1</link>
    </route>
    <route>
        <destination>C</destination>
        <nodeAddress>localhost:10103</nodeAddress>
        <cost>1</cost>
        <link>2</link>
    </route>
    <route>
        <destination>E</destination>
        <nodeAddress>localhost:10105</nodeAddress>
        <cost>1</cost>
        <link>4</link>
    </route>
</routes>
